{
  "$schema": "https://json-schema.org/draft/2020-12/schema",
  "$id": "edu-question-spec.schema.json",
  "title": "edu-question-spec.v1",
  "type": "object",
  "required": ["subject", "question_type", "difficulty"],
  "anyOf": [
    { "required": ["knowledge_points"] },
    { "required": ["knowledge_point"] }
  ],
  "properties": {
    "version": { "const": "edu-question-spec.v1" },
    "request_id": { "type": "string" },
    "locale": { "type": "string", "default": "zh-CN" },
    "grade_band": { "type": "string" },
    "subject": { "type": "string", "minLength": 1 },
    "knowledge_points": {
      "type": "array",
      "items": { "type": "string", "minLength": 1 },
      "minItems": 1
    },
    "knowledge_point": { "type": "string", "minLength": 1 },
    "curriculum_goal": { "type": "string" },
    "question_type": {
      "enum": ["single_choice", "multiple_choice", "true_false", "fill_blank", "short_answer"]
    },
    "difficulty": {
      "type": "integer",
      "minimum": 1,
      "maximum": 6
    },
    "count": {
      "type": "integer",
      "minimum": 1,
      "maximum": 20,
      "default": 1
    },
    "content_mode": {
      "enum": ["text", "image", "diagram_optional", "diagram_required"],
      "default": "text"
    },
    "image_requirement": {
      "oneOf": [
        { "type": "string" },
        {
          "type": "object",
          "properties": {
            "required": { "type": "boolean" },
            "image_required": { "type": "boolean" },
            "position": { "enum": ["stem", "options", "explanation"] },
            "image_position": { "enum": ["stem", "options", "explanation"] },
            "answer_relevant": { "type": "boolean" },
            "must_be_answer_relevant": { "type": "boolean" }
          }
        }
      ]
    },
    "diagram": {
      "type": "object",
      "properties": {
        "required": { "type": "boolean" },
        "position": { "enum": ["stem", "options", "explanation"] },
        "must_be_answer_relevant": { "type": "boolean" },
        "style": { "type": "string" }
      }
    },
    "strategy": {
      "enum": ["direct", "cot", "react", "dear", "eqpr", "evoq"],
      "default": "direct"
    },
    "algorithm": {
      "enum": ["direct", "cot", "react", "dear", "eqpr", "evoq"],
      "default": "direct"
    },
    "teacher_profile": { "type": "object" },
    "student_profile": { "type": "object" },
    "source_material": { "type": "string" },
    "extra_requirements": { "type": "string" }
  }
}
